{
  "$schema": "http://json-schema.org/draft-07/schema#",
  "$id": "https://palace-whiteroom/schemas/integration_plan.json",
  "title": "IntegrationPlan",
  "description": "Produced by the Synthesizer per cycle. A structured description of all the writes the cycle wants to make to the project surface — slices, concepts, dependency-map edges, lessons, log entries. The orchestrator's integrator applies these section by section with semantic-merge discipline (idempotent edges, append-section semantics for concept extensions, dedupe-on-append for lessons). Designed to be the data structure the Phase-8 parallel-cycle integrator consumes; in the current serial model the integrator processes one plan per cycle. See `scaffolding/decisions/integration-plan-architecture.md` for design rationale.",
  "type": "object",
  "required": ["rotation_claims"],
  "properties": {
    "slice_writes": {
      "type": "array",
      "description": "Per-slice file writes. Each entry creates a new slice file or modifies an existing one. Prefer file_edits below for surgical edits to existing files.",
      "items": {
        "type": "object",
        "required": ["path"],
        "properties": {
          "path": { "type": "string", "description": "Relative path under book/src/spec/slices/, e.g., 'gmres/step.md' or 'orthog.md'." },
          "mode": {
            "type": "string",
            "enum": ["create", "diff"],
            "default": "create",
            "description": "`create` for new files (write content directly); `diff` for modifications to existing files (apply as unified diff). For surgical edits, prefer the top-level `file_edits` field which is more reliable than unified diffs."
          },
          "content": { "type": "string", "description": "For mode=create: the full file content." },
          "diff": { "type": "string", "description": "For mode=diff: a unified-diff string targeting the existing file." },
          "title": { "type": "string", "description": "Optional. For mode=create: the human-readable title to use in the SUMMARY.md auto-registration entry (e.g., 'GMRES' for the gmres slice). If omitted, the orchestrator derives a title from the slug. Added post meta-review #8 with SUMMARY.md auto-registration." }
        }
      }
    },
    "plan_kind": {
      "type": "string",
      "enum": ["new_content", "retroactive_claims", "tightening", "back_correction"],
      "description": "Optional. The kind of work this cycle does. Default `new_content`. Added meta-10 item 2 after cycle 36 produced a 0-substantive-writes pass that the Meta-Critic couldn't distinguish from a no-op. Tightened meta-13: retroactive_claims is RESERVED for cycles whose ONLY writes are rotation_claims/lessons/dep-map-edges (no slice creates or layer-section appends). Values: `new_content` = produces new slice/concept content on disk; `retroactive_claims` = emits rotation_claims for content that already exists on disk; `tightening` = revises an existing layer's content for internal correctness (no layer advancement); `back_correction` = restructures a lower layer in response to a push-back signal."
    },
    "retroactive_against_cycle": {
      "type": "integer",
      "minimum": 1,
      "description": "Optional. When plan_kind=retroactive_claims, the cycle_id whose on-disk content is being claimed against. Added meta-14 item 3 to make legitimate backfills auditable from episodic alone (Meta-Critic can verify cycle N+k retroactive_claims actually point at on-disk content from cycle N). If the prose has accumulated over multiple cycles, name the most recent landing cycle."
    },
    "slice_index_updates": {
      "type": "array",
      "description": "Status-table row updates for `book/src/spec/index.md`. Added meta-10 item 1 (recurrence #2 of `file_edits` anchor mismatch on spec/index.md). The integrator locates the row by link-target anchor (`(./slices/<slug>.md)` or `(./slices/<slug>/index.md)`) and rewrites the layer/date/summary cells mechanically. The Synthesizer no longer needs to copy the row verbatim. Idempotent on (slice, layer, date, summary). Reserved for the in-table row update; `file_edits` on `spec/index.md` remains valid for non-row edits (headers, conventions).",
      "items": {
        "type": "object",
        "required": ["slice", "layer", "summary"],
        "properties": {
          "slice": { "type": "string", "description": "The slice slug; must match the path in `book/src/spec/slices/<slug>.md` or `<slug>/index.md`." },
          "layer": { "type": "string", "description": "The new highest layer text (e.g., 'L4', 'L2 (slice v0.3)')." },
          "date": { "type": "string", "description": "Optional. The 'last touched' value. Defaults to today's UTC date if omitted." },
          "summary": { "type": "string", "description": "The status notes cell — a sentence or two describing the current slice state." },
          "link_title": { "type": "string", "description": "Optional. Override the link display text in the row. Defaults to the existing title or the slug." }
        }
      }
    },
    "section_appends": {
      "type": "array",
      "description": "Append a new top-level section (`## Heading`) to the end of an existing file. The THIRD edit topology, alongside file-creation (slice_writes mode=create / concept_writes mode=create) and in-place modification (file_edits). Added 2026-05-24 meta-review #7 after diff-on-edit failures recurred in the section-append sub-mode. Each entry locates the file, verifies the exact heading line does NOT already exist (idempotency check), and inserts the new section at the end of the file. Use this for adding a new layer section (## L2, ## L3, ...) to an existing slice file, OR a new top-level section to any existing markdown file under book/src/ or scaffolding/.",
      "items": {
        "type": "object",
        "required": ["path", "heading", "content"],
        "properties": {
          "path": { "type": "string", "description": "Repo-relative path to an EXISTING markdown file. Safe-path policy as file_edits." },
          "heading": { "type": "string", "description": "The exact `## Heading` line (markdown heading-2 syntax). The integrator rejects if this line already exists in the file." },
          "content": { "type": "string", "description": "The section body, NOT including the heading line. May contain subsections (### ...) and prose freely. Leading/trailing whitespace is trimmed." }
        }
      }
    },
    "file_edits": {
      "type": "array",
      "description": "Find-replace edits to existing files (any path under book/src/, scaffolding/, or problems/). Symmetric to file_creates but for existing files. Each entry replaces the exact match of `old_string` with `new_string` in the named file. The orchestrator enforces exactly-one-match unless `replace_all` is true; an ambiguous old_string is rejected. This is the preferred edit channel — more reliable than unified diffs across LLM emissions. Added 2026-05-24 meta-review #6 after diff-on-edit failures recurred 6+ times.",
      "items": {
        "type": "object",
        "required": ["path", "old_string", "new_string"],
        "properties": {
          "path": { "type": "string", "description": "Repo-relative path to an EXISTING file. Same safe-path policy as file_creates (book/src/, scaffolding/, problems/)." },
          "old_string": { "type": "string", "description": "Exact text to replace. Must match the file content unambiguously (one occurrence) unless replace_all is true. Multi-line strings are supported." },
          "new_string": { "type": "string", "description": "Replacement text. May be empty (deletion)." },
          "replace_all": { "type": "boolean", "default": false, "description": "If true, replaces every occurrence. Default false (exactly-one-match required)." }
        }
      }
    },
    "concept_writes": {
      "type": "array",
      "description": "Concept-page writes. Each entry creates a new concept entry or extends an existing one with a new section. Multiple cycles touching the same concept page accumulate non-conflictingly when they target distinct sections.",
      "items": {
        "type": "object",
        "required": ["name", "mode"],
        "properties": {
          "name": { "type": "string", "description": "Concept slug, matches the filename stem under book/src/concepts/." },
          "mode": {
            "type": "string",
            "enum": ["create", "append-section"],
            "description": "`create` for new concept files; `append-section` to add a new ## section to an existing concept page."
          },
          "content": { "type": "string", "description": "For mode=create: the full concept-page content. For mode=append-section: the section content INCLUDING the leading `## Heading` line." },
          "kind": { "type": "string", "enum": ["methodology", "algorithm", "primitive", "layer-pattern", "auxiliary"], "description": "Optional, for mode=create. The category for the concepts/index.md table row. Defaults to `primitive` if omitted. Added meta-15." }
        }
      }
    },
    "dependency_map_edges": {
      "type": "array",
      "description": "Edges to add to the concept dependency map (book/src/concepts/dependency-map.md). Idempotent: an edge that already exists is silently skipped. New nodes are added implicitly; new layer subsections need to be added via a separate slice_writes entry editing the file.",
      "items": {
        "type": "object",
        "required": ["layer", "from", "to"],
        "properties": {
          "layer": { "type": "string", "enum": ["methodology", "L1", "L2", "L3", "L4"], "description": "Which layer subsection of the dependency map this edge belongs to." },
          "from": { "type": "string", "description": "The concept that depends on the to-concepts." },
          "to": { "type": "array", "items": { "type": "string" }, "description": "The concept(s) the from-concept depends on. May be empty for root concepts (just adds the node)." }
        }
      }
    },
    "lessons": {
      "type": "array",
      "description": "Lesson lines to append to lessons.md. Dedupe-on-append: if an identical line already exists in lessons.md, it's skipped. Date-prefix is added by the integrator.",
      "items": { "type": "string" }
    },
    "log_synthesis": {
      "type": "string",
      "description": "One-line summary of what the cycle produced. The integrator builds the LOG.md entry from this plus cycle metadata (verdict, friction, structural_change) — the Synthesizer does NOT format the LOG entry directly."
    },
    "rotation_claims": {
      "type": "array",
      "description": "Per-edge rotation_claims, validating against schemas/rotation_claim.json. The Synthesizer's primary output for verification purposes.",
      "items": { "type": "object" }
    }
  }
}
